{
  "id": "chrome-devtools",
  "name": "Chrome DevTools MCP",
  "icon": "🔧",
  "logo": "/icons/brands/googlechrome.svg",
  "category": "Design & Dev",
  "description": "Local stdio MCP: automate Chrome (tabs, snapshots, screenshots, console, network). Runs the copy pinned and shipped with Vodou; usage statistics off.",
  "localStdio": true,
  "stdioCommand": "node",
  "stdioArgs": [
    "MCP-servers/chrome-devtools-mcp/node_modules/chrome-devtools-mcp/build/src/bin/chrome-devtools-mcp.js",
    "--usageStatistics=false",
    "--performanceCrux=false"
  ],
  "mcpUrl": "stdio: node MCP-servers/chrome-devtools-mcp/…/chrome-devtools-mcp.js",
  "mcpTransport": "stdio",
  "setupDocsUrl": "https://github.com/ChromeDevTools/chrome-devtools-mcp",
  "setupSteps": [
    {
      "title": "Prerequisites",
      "instructions": "Install <strong>Google Chrome</strong> (or Edge, Brave or Chromium). The server itself ships with Vodou — nothing to download."
    },
    {
      "title": "Add server",
      "instructions": "Click <strong>Add server</strong> below. Vodou runs <code>vodou-core connect chrome-devtools …</code> with the copy pinned in <code>MCP-servers/chrome-devtools-mcp</code>.",
      "gotcha": "If tools stay at 0, use <strong>Test connection</strong> after enabling the server under Capabilities."
    },
    {
      "title": "Enable in Tools",
      "instructions": "Open <strong>Capabilities → MCP Servers</strong> and turn <strong>chrome-devtools</strong> on so chat can call its tools."
    }
  ]
}
